{
  "task_id": "key_011",
  "score_id": "score_014",
  "category": "key_harmony",
  "difficulty": "easy",
  "instruction_en": "Change the key signature to G minor without transposing any note.",
  "instruction_zh": "将调号改为G minor，但不要移调任何音符。",
  "target_scope": {
    "whole_score": true
  },
  "protected_scope": {},
  "gold_patch_path": "gold_patches/key_011.json",
  "expected_output_path": "expected_outputs/key_011.score.json",
  "expected_constraints": [
    {
      "type": "key_equals",
      "value": "G minor"
    },
    {
      "type": "preserve_pitch"
    }
  ],
  "expected_status": "success",
  "unsupported_reason": null,
  "tags": [
    "batch3",
    "synthetic",
    "deterministic",
    "key_harmony"
  ],
  "created_by": "rule_template",
  "review_status": "pending_human_review"
}
